[
  {
    "kind" : "label" ,
    "id" : 2008 ,
    "project_id" : 99 ,
    "name" : "plans" ,
    "created_at" : "2014-07-22T12:00:00Z" ,
    "updated_at" : "2014-07-22T12:00:00Z"
  } , {
    "kind" : "label" ,
    "id" : 2007 ,
    "project_id" : 99 ,
    "name" : "rebel bases" ,
    "created_at" : "2014-07-22T12:00:00Z" ,
    "updated_at" : "2014-07-22T12:00:00Z"
  }
]